{
  "schema": "factory/gate@1",
  "id": "GATE-0003",
  "rev": 2,
  "created_at": "2026-10-11T13:30:00.000Z",
  "updated_at": "2026-10-11T14:00:00.000Z",
  "type": "G3",
  "subject": {
    "kind": "goal",
    "id": "G-001"
  },
  "goal_id": "G-001",
  "status": "approved",
  "opened_at": "2026-10-11T13:30:00.000Z",
  "opened_by": {
    "run_id": null,
    "actor": "ui-ux-designer"
  },
  "artifact": {
    "paths": [
      "docs/G-001-vin-decoder/design/intake.html"
    ],
    "summary": "Intake mockup."
  },
  "request": {},
  "decision": {
    "by": "owner",
    "via": "dashboard",
    "at": "2026-10-11T14:00:00.000Z",
    "notes": "Use the existing panel component."
  },
  "auto": false
}
