{
  "schema": "factory/gate@1",
  "id": "GATE-0006",
  "rev": 1,
  "created_at": "2026-10-12T13:30:00.000Z",
  "updated_at": "2026-10-12T13:30:00.000Z",
  "type": "G4",
  "subject": {
    "kind": "epic",
    "id": "E-0001"
  },
  "goal_id": "G-001",
  "status": "pending",
  "opened_at": "2026-10-12T13:30:00.000Z",
  "opened_by": {
    "run_id": null,
    "actor": "cto"
  },
  "artifact": {
    "paths": [
      "docs/G-001-vin-decoder/reviews/E-0001.md",
      "docs/G-001-vin-decoder/qa/E-0001.md",
      "runs/R-000011/evidence/qa-run-1.log"
    ],
    "pr_url": "https://github.com/example/dealer-app/pull/128",
    "summary": "Decoder service and API: QA passed, epic review passed, docs done. Merge PR #128 on GitHub, then approve.",
    "diffstat": "+412 -88, 9 files"
  },
  "request": {},
  "decision": null,
  "auto": false
}
